{
  "schema_version": "1.0.0",
  "message_type": "landmarks",
  "trace_id": "7f3c2a9e-4b1d-4e8a-9c6f-2d5e8b1a0c37",
  "session_id": "sess-01",
  "frame_id": 1045,
  "timestamp_ms": 1793260800222,
  "image_width": 640,
  "image_height": 480,
  "hands": [
    {
      "hand_index": 0,
      "handedness": "Right",
      "confidence": 0.97,
      "landmarks": [
        {
          "id": 0,
          "x": 0.512,
          "y": 0.781,
          "z": 0.0
        },
        {
          "id": 1,
          "x": 0.448,
          "y": 0.742,
          "z": -0.021
        },
        {
          "id": 2,
          "x": 0.43,
          "y": 0.7,
          "z": -0.032
        },
        {
          "id": 3,
          "x": 0.445,
          "y": 0.668,
          "z": -0.041
        },
        {
          "id": 4,
          "x": 0.47,
          "y": 0.65,
          "z": -0.05
        },
        {
          "id": 5,
          "x": 0.468,
          "y": 0.598,
          "z": -0.018
        },
        {
          "id": 6,
          "x": 0.466,
          "y": 0.648,
          "z": -0.029
        },
        {
          "id": 7,
          "x": 0.468,
          "y": 0.686,
          "z": -0.037
        },
        {
          "id": 8,
          "x": 0.47,
          "y": 0.698,
          "z": -0.044
        },
        {
          "id": 9,
          "x": 0.512,
          "y": 0.601,
          "z": -0.016
        },
        {
          "id": 10,
          "x": 0.519,
          "y": 0.652,
          "z": -0.03
        },
        {
          "id": 11,
          "x": 0.516,
          "y": 0.689,
          "z": -0.028
        },
        {
          "id": 12,
          "x": 0.512,
          "y": 0.702,
          "z": -0.022
        },
        {
          "id": 13,
          "x": 0.553,
          "y": 0.615,
          "z": -0.017
        },
        {
          "id": 14,
          "x": 0.56,
          "y": 0.664,
          "z": -0.031
        },
        {
          "id": 15,
          "x": 0.556,
          "y": 0.698,
          "z": -0.027
        },
        {
          "id": 16,
          "x": 0.551,
          "y": 0.709,
          "z": -0.02
        },
        {
          "id": 17,
          "x": 0.589,
          "y": 0.636,
          "z": -0.019
        },
        {
          "id": 18,
          "x": 0.594,
          "y": 0.676,
          "z": -0.029
        },
        {
          "id": 19,
          "x": 0.59,
          "y": 0.703,
          "z": -0.026
        },
        {
          "id": 20,
          "x": 0.585,
          "y": 0.714,
          "z": -0.021
        }
      ]
    }
  ],
  "vision_ms": 14.8,
  "model": "hand_landmarker.task@float16"
}
